{
  "assumptions": [
    "Annual cash flows",
    "Flat synthetic discount curve"
  ],
  "base_yield": "0.04",
  "bond_id": "bond.synthetic.001",
  "cash_flows": [
    {
      "amount": "50.00",
      "payment_date": "2026-01-01"
    },
    {
      "amount": "1050.00",
      "payment_date": "2027-01-01"
    }
  ],
  "convexity_years2": "4.25",
  "currency": "EUR",
  "duration_years": "1.90",
  "face_value": "1000.00",
  "present_value": "1000.00",
  "scenario_id": "scenario.synthetic.001",
  "schema_version": "1.0.0",
  "spread_adjustment_bps": 50,
  "valuation_date": "2025-01-01",
  "z_spread_bps": 50
}
